{
  "schema_version": 1,
  "event_id": "01928f3b-6c31-7d01-9bcd-5e9f1a3b7d4a",
  "timestamp": "2026-10-09T15:47:54.540189619Z",
  "timestamp_trusted": true,
  "source_tag": "synthetic",
  "sensor": {
    "name": "pulsar",
    "version": "0.10.1",
    "platform": "linux-aarch64"
  },
  "host": "koru-lab",
  "process": {
    "pid": 5443,
    "ppid": 5390,
    "start_time": "2026-10-09T15:47:54.537356193Z",
    "exe": "/usr/bin/cat",
    "command_line": [
      "cat",
      "/home/koru/.ssh/id_ed25519"
    ],
    "environment": [],
    "user": {
      "uid": 1000,
      "gid": 1000
    },
    "lineage": [
      {
        "pid": 5390,
        "exe": "/usr/bin/bash",
        "command_line": [
          "bash"
        ]
      },
      {
        "pid": 1,
        "exe": "/usr/lib/systemd/systemd",
        "command_line": [
          "/sbin/init"
        ]
      }
    ]
  },
  "container": {
    "id": null,
    "name": null,
    "image": null,
    "image_digest": null,
    "namespaces": {
      "uts": 4026531838,
      "ipc": 4026531839,
      "mnt": 4026531841,
      "pid": 4026531836,
      "net": 4026531840,
      "time": 4026531834,
      "cgroup": 4026531835
    }
  },
  "event_type": "network_connection",
  "target": {
    "path": null,
    "new_path": null,
    "flags": [],
    "hard_link": null,
    "protocol": "tcp",
    "local": null,
    "remote": {
      "ip": "2001:db8::1",
      "port": 443
    },
    "exit_code": null
  },
  "actor": {
    "kind": "unknown",
    "rationale": [],
    "confidence": 0.0
  },
  "detection": null,
  "tags": {
    "intent": null,
    "mitre_techniques": [],
    "verified": false
  },
  "session_id": null,
  "response": null
}
