{
  "schema_version": 1,
  "event_id": "01928f3b-6c32-7e9a-a1b2-6fa02b4c8e5b",
  "timestamp": "2026-10-09T15:47:54.540189619Z",
  "timestamp_trusted": true,
  "source_tag": "legitimate",
  "sensor": {
    "name": "pulsar",
    "version": "0.10.1",
    "platform": "linux-aarch64"
  },
  "host": "koru-lab",
  "process": {
    "pid": 5443,
    "ppid": 5390,
    "start_time": "2026-10-09T15:47:54.537356193Z",
    "exe": "/usr/bin/node",
    "command_line": [
      "node",
      "/opt/mcp/sunucu.js"
    ],
    "environment": [
      "MCP_SUNUCU=1"
    ],
    "user": {
      "uid": 1000,
      "gid": 1000
    },
    "lineage": [
      {
        "pid": 4100,
        "exe": "/usr/local/bin/claude",
        "command_line": [
          "claude"
        ]
      }
    ]
  },
  "container": {
    "id": "ac723a96d4435aa4f5e400cafd7a9152b565e49c810a74f0b6485e2cef06506f",
    "name": "silly_cartwright",
    "image": "docker.io/library/alpine:3.22",
    "image_digest": "sha256:5291449c3df73caf6ed85e649dec1b9e818b39a5d8c871e97afc13e9cd5e8fa8",
    "namespaces": {
      "uts": 4026532417,
      "ipc": 4026532419,
      "mnt": 4026532418,
      "pid": 4026532421,
      "net": 4026532346,
      "time": 4026531834,
      "cgroup": 4026532422
    }
  },
  "event_type": "file_opened",
  "target": {
    "path": "/root/.cursor/mcp.json",
    "new_path": null,
    "flags": [
      "O_RDONLY"
    ],
    "hard_link": null,
    "protocol": null,
    "local": null,
    "remote": null,
    "exit_code": null
  },
  "actor": {
    "kind": "ai_agent",
    "rationale": [
      "coding assistant in lineage: /usr/local/bin/claude",
      "the process is an MCP server"
    ],
    "confidence": 0.85
  },
  "detection": {
    "rule": "koru.decoy.mcp-config-read",
    "decoy_id": "tz-7f3a9c41",
    "threat_class": "suspected_hijacked_agent",
    "attack": [
      "T1552.001"
    ]
  },
  "tags": {
    "intent": "credential_search",
    "mitre_techniques": [
      "T1552.001",
      "T1083"
    ],
    "verified": true
  },
  "session_id": "oturum-2026-10-09-0001",
  "response": {
    "action": "record",
    "timestamp": "2026-10-09T15:47:55.000000000Z",
    "rationale": "shadow mode: action only recorded"
  }
}
