{
  "schema_version": 1,
  "event_id": "01928f3b-6c30-7c55-b0aa-4d8e0f2a6c39",
  "timestamp": "2026-10-09T15:47:54.540189619Z",
  "timestamp_trusted": false,
  "source_tag": "real",
  "sensor": {
    "name": "pulsar",
    "version": "0.10.1",
    "platform": "linux-aarch64"
  },
  "host": "koru-lab",
  "process": {
    "pid": 5443,
    "ppid": 5390,
    "start_time": null,
    "exe": "/usr/bin/cat",
    "command_line": [
      "cat",
      "/home/koru/.ssh/id_ed25519"
    ],
    "environment": [],
    "user": {
      "uid": 1000,
      "gid": 1000
    },
    "lineage": []
  },
  "container": {
    "id": null,
    "name": null,
    "image": null,
    "image_digest": null,
    "namespaces": null
  },
  "event_type": "process_exited",
  "target": {
    "path": null,
    "new_path": null,
    "flags": [],
    "hard_link": null,
    "protocol": null,
    "local": null,
    "remote": null,
    "exit_code": 1
  },
  "actor": {
    "kind": "unknown",
    "rationale": [],
    "confidence": 0.0
  },
  "detection": null,
  "tags": {
    "intent": null,
    "mitre_techniques": [],
    "verified": false
  },
  "session_id": null,
  "response": null
}
